{
  "formatVersion": 1,
  "generator": "hand-authored example",
  "universe": {
    "slug": "aetheria",
    "name": "Aetheria",
    "description": "A high-fantasy world of warring orders and old magic.",
    "locale": "en"
  },
  "calendar": {
    "eras": [
      { "slug": "third-age", "name": "The Third Age", "maxYears": 1000, "resetsWeek": true }
    ],
    "months": [
      { "name": "Frostfall", "days": 30 },
      { "name": "Embertide", "days": 31 },
      { "name": "Highsun", "days": 31 }
    ],
    "weekdays": [
      { "name": "Sunday", "short": "Sun" },
      { "name": "Moonday", "short": "Mon" }
    ]
  },
  "codexCategories": [
    {
      "key": "factions",
      "label": "Factions",
      "color": "#6b8fd6",
      "description": "Orders, guilds, and powers that shape the world."
    }
  ],
  "characters": [
    {
      "slug": "lyra-dawnwhisper",
      "name": "Lyra Dawnwhisper",
      "description": "An archmage of the Azure Order, exiled for a heresy she did not commit.",
      "relatedRefs": [{ "kind": "place", "ref": "silverhold" }]
    },
    {
      "slug": "garrett-stone",
      "name": "Garrett Stone",
      "description": "A knight-captain sworn to ${pl:silverhold}[Silverhold], torn between duty and conscience."
    }
  ],
  "places": [
    {
      "slug": "silverhold",
      "name": "Silverhold",
      "description": "A fortress city carved into the white cliffs, seat of the Azure Order."
    }
  ],
  "plotlines": [
    {
      "slug": "the-shattered-crown",
      "title": "The Shattered Crown",
      "description": "The succession crisis that follows the old king's death.",
      "status": "active",
      "color": "#d6a36b"
    }
  ],
  "events": [
    {
      "slug": "the-coronation",
      "name": "The Contested Coronation",
      "description": "Two claimants are crowned on the same day within ${pl:silverhold}[Silverhold].",
      "inGameDate": { "era": "third-age", "year": 412, "month": 2, "day": 14 },
      "plotlineRefs": [{ "kind": "plotline", "ref": "the-shattered-crown" }]
    }
  ],
  "codexEntries": [
    {
      "slug": "the-azure-order",
      "title": "The Azure Order",
      "category": "factions",
      "description": "An ancient circle of mages. ${ch:lyra-dawnwhisper}[Lyra Dawnwhisper] was once its brightest member."
    }
  ],
  "stories": [
    {
      "slug": "the-gathering-storm",
      "title": "The Gathering Storm",
      "description": "Lyra returns to Silverhold on the eve of the coronation.",
      "draft": false,
      "inGameDate": { "era": "third-age", "year": 412, "month": 2, "day": 13 },
      "plotlineRefs": [{ "kind": "plotline", "ref": "the-shattered-crown" }],
      "startScene": "title",
      "scenes": {
        "title": {
          "text": "The Gathering Storm",
          "layout": "showcase",
          "characters": [],
          "next": [{ "scene": "approach" }]
        },
        "approach": {
          "text": "Rain lashed the white cliffs of ${pl:silverhold}[Silverhold]. ${ch:lyra-dawnwhisper}[Lyra] climbed the last stair to the gate, her cloak heavy with the storm.",
          "place": { "kind": "place", "ref": "silverhold" },
          "characters": [
            { "entity": { "kind": "character", "ref": "lyra-dawnwhisper" }, "position": "center" }
          ],
          "next": [{ "scene": "the-gate" }]
        },
        "the-gate": {
          "text": "The gate groaned open. A knight stood in the torchlight, one hand resting on the hilt of his sword.",
          "place": { "kind": "place", "ref": "silverhold" },
          "characters": [
            { "entity": { "kind": "character", "ref": "lyra-dawnwhisper" }, "position": "left" },
            { "entity": { "kind": "character", "ref": "garrett-stone" }, "position": "right" }
          ],
          "next": [{ "scene": "challenge" }]
        },
        "challenge": {
          "text": "You should not have come back, Lyra.",
          "speaker": { "kind": "character", "ref": "garrett-stone" },
          "place": { "kind": "place", "ref": "silverhold" },
          "characters": [
            { "entity": { "kind": "character", "ref": "lyra-dawnwhisper" }, "position": "left" },
            { "entity": { "kind": "character", "ref": "garrett-stone" }, "position": "right" }
          ],
          "next": [{ "scene": "answer" }]
        },
        "answer": {
          "text": "And yet here I am. The coronation is tomorrow, and someone has to stop it.",
          "speaker": { "kind": "character", "ref": "lyra-dawnwhisper" },
          "place": { "kind": "place", "ref": "silverhold" },
          "characters": [
            { "entity": { "kind": "character", "ref": "lyra-dawnwhisper" }, "position": "left" },
            { "entity": { "kind": "character", "ref": "garrett-stone" }, "position": "right" }
          ],
          "next": [{ "scene": "the-threshold" }]
        },
        "the-threshold": {
          "text": "Garrett held her gaze for a long moment. Then he stepped aside, and the open gate stood between them like a question.",
          "place": { "kind": "place", "ref": "silverhold" },
          "characters": [
            { "entity": { "kind": "character", "ref": "lyra-dawnwhisper" }, "position": "left" },
            { "entity": { "kind": "character", "ref": "garrett-stone" }, "position": "right" }
          ],
          "next": []
        }
      }
    }
  ]
}
